{
  "schemaVersion": "1.0.0",
  "generatedBy": "scripts/build-manifest.py",
  "solutionId": "agent-cost-reporting",
  "solutionName": "Agent Cost Reporting",
  "solutionVersion": "0.1.1-preview",
  "status": "preview",
  "controls": [
    {
      "id": "1.7",
      "coverage": "full"
    },
    {
      "id": "3.1",
      "coverage": "full"
    },
    {
      "id": "3.2",
      "coverage": "full"
    }
  ],
  "controlCount": 3
}
