{
  "schemaVersion": "1.0.0",
  "generatedBy": "scripts/build-manifest.py",
  "solutionId": "environment-lifecycle-management",
  "solutionName": "Environment Lifecycle Management",
  "solutionVersion": "1.2.2",
  "status": "live",
  "controls": [
    {
      "id": "2.1",
      "coverage": "full"
    },
    {
      "id": "2.2",
      "coverage": "full"
    },
    {
      "id": "2.8",
      "coverage": "full"
    },
    {
      "id": "1.7",
      "coverage": "full"
    }
  ],
  "controlCount": 4
}
