{
  "schemaVersion": "1.0.0",
  "generatedBy": "scripts/build-manifest.py",
  "solutionId": "agent-sharing-access-restriction-detector",
  "solutionName": "Agent Sharing Access Restriction Detector",
  "solutionVersion": "2.0.2",
  "status": "live",
  "controls": [
    {
      "id": "1.18",
      "coverage": "full"
    },
    {
      "id": "2.8",
      "coverage": "full"
    }
  ],
  "controlCount": 2
}
