{
  "schemaVersion": "1.0.0",
  "generatedBy": "scripts/build-manifest.py",
  "solutionId": "audit-compliance-manager",
  "solutionName": "Audit Compliance Manager",
  "solutionVersion": "1.0.5",
  "status": "live",
  "controls": [
    {
      "id": "1.7",
      "coverage": "full"
    }
  ],
  "controlCount": 1
}
