{
  "schemaVersion": "1.0.0",
  "generatedBy": "scripts/build-manifest.py",
  "solutionId": "pipeline-governance-cleanup",
  "solutionName": "Pipeline Governance Cleanup",
  "solutionVersion": "1.2.1",
  "status": "live",
  "controls": [
    {
      "id": "2.3",
      "coverage": "full"
    },
    {
      "id": "2.1",
      "coverage": "full"
    }
  ],
  "controlCount": 2
}
