{
  "schemaVersion": "1.0.0",
  "generatedBy": "scripts/build-manifest.py",
  "solutionId": "agent-knowledge-source-scanner",
  "solutionName": "Agent Knowledge Source Scanner",
  "solutionVersion": "1.1.2",
  "status": "live",
  "controls": [
    {
      "id": "4.3",
      "coverage": "full"
    },
    {
      "id": "1.4",
      "coverage": "full"
    },
    {
      "id": "1.5",
      "coverage": "full"
    }
  ],
  "controlCount": 3
}
