{
  "schemaVersion": "1.0.0",
  "generatedBy": "scripts/build-manifest.py",
  "solutionId": "agent-observability-foundation",
  "solutionName": "Agent Observability Foundation",
  "solutionVersion": "1.2.5",
  "status": "live",
  "controls": [
    {
      "id": "1.7",
      "coverage": "full"
    },
    {
      "id": "2.8",
      "coverage": "full"
    },
    {
      "id": "2.9",
      "coverage": "full"
    },
    {
      "id": "3.2",
      "coverage": "full"
    }
  ],
  "controlCount": 4
}
