{
  "schemaVersion": "1.0.0",
  "generatedBy": "scripts/build-manifest.py",
  "solutionId": "copilot-agent-inventory",
  "solutionName": "Copilot Agent Inventory",
  "solutionVersion": "0.2.0-preview",
  "status": "preview",
  "controls": [
    {
      "id": "1.2",
      "coverage": "full"
    },
    {
      "id": "1.7",
      "coverage": "full"
    },
    {
      "id": "2.1",
      "coverage": "full"
    },
    {
      "id": "2.13",
      "coverage": "full"
    }
  ],
  "controlCount": 4
}
