{
  "schemaVersion": "1.0.0",
  "generatedBy": "scripts/build-manifest.py",
  "solutionId": "agent-intake",
  "solutionName": "Agent Intake",
  "solutionVersion": "1.0.1-preview",
  "status": "preview",
  "controls": [
    {
      "id": "1.2",
      "coverage": "full"
    },
    {
      "id": "1.7",
      "coverage": "full"
    },
    {
      "id": "2.1",
      "coverage": "full"
    },
    {
      "id": "2.13",
      "coverage": "full"
    },
    {
      "id": "3.1",
      "coverage": "full"
    }
  ],
  "controlCount": 5
}
