{
  "schemaVersion": "1.0.0",
  "generatedBy": "scripts/build-manifest.py",
  "solutionId": "finra-supervision-workflow",
  "solutionName": "FINRA Supervision Workflow",
  "solutionVersion": "1.1.1",
  "status": "live",
  "controls": [
    {
      "id": "2.12",
      "coverage": "full"
    },
    {
      "id": "1.10",
      "coverage": "full"
    },
    {
      "id": "1.7",
      "coverage": "full"
    }
  ],
  "controlCount": 3
}
